{
  "schemaVersion": 2,
  "versionLabel": "1.21.11",
  "officialJvmName": "net.minecraft.client.model.effects.EvokerFangsModel",
  "profile": "proguard_1.21.11",
  "extractionStatus": "ok",
  "extractionNotes": [
    "Part tree lifted from bytecode_asm (mesh host net.minecraft.client.model.effects.EvokerFangsModel).",
    "Mesh lift parser notes (2): Lifted via bytecode disassembly \u002B segment parser (exact pool constants).; addBox at line 10: could not parse texOffs (defaulting to 0,0)."
  ],
  "factoryMethod": "createBodyLayer",
  "roots": [
    {
      "id": "root",
      "pose": {
        "translation": [
          0,
          0,
          0
        ],
        "rotationEulerRad": [
          0,
          0,
          0
        ],
        "eulerOrder": "XYZ"
      },
      "cuboids": [],
      "children": [
        {
          "id": "base",
          "pose": {
            "translation": [
              -5,
              24,
              -5
            ],
            "rotationEulerRad": [
              0,
              0,
              0
            ],
            "eulerOrder": "XYZ",
            "setupAnimPivot": [
              -5,
              24,
              -5
            ]
          },
          "cuboids": [
            {
              "from": [
                0,
                0,
                0
              ],
              "to": [
                10,
                12,
                10
              ],
              "uvOrigin": [
                0,
                0
              ],
              "textureKey": "#skin",
              "liftKind": "exact",
              "provenance": "javap lift fluent addBox profile_proguard_obf"
            }
          ],
          "children": [
            {
              "id": "upper_jaw",
              "pose": {
                "translation": [
                  0,
                  0,
                  0
                ],
                "rotationEulerRad": [
                  0,
                  0,
                  0
                ],
                "eulerOrder": "XYZ",
                "setupAnimPivot": [
                  0,
                  0,
                  0
                ]
              },
              "cuboids": [
                {
                  "from": [
                    0,
                    0,
                    0
                  ],
                  "to": [
                    4,
                    14,
                    8
                  ],
                  "uvOrigin": [
                    40,
                    0
                  ],
                  "textureKey": "#skin",
                  "liftKind": "exact",
                  "provenance": "javap lift fluent addBox profile_proguard_obf"
                },
                {
                  "from": [
                    6.5,
                    0,
                    1
                  ],
                  "to": [
                    6.5,
                    0,
                    3.0420351
                  ],
                  "uvOrigin": [
                    40,
                    0
                  ],
                  "textureKey": "#skin",
                  "liftKind": "exact",
                  "provenance": "javap lift fluent addBox profile_proguard_obf"
                }
              ],
              "children": []
            },
            {
              "id": "lower_jaw",
              "pose": {
                "translation": [
                  0,
                  0,
                  0
                ],
                "rotationEulerRad": [
                  0,
                  0,
                  0
                ],
                "eulerOrder": "XYZ",
                "setupAnimPivot": [
                  0,
                  0,
                  0
                ]
              },
              "cuboids": [
                {
                  "from": [
                    3.5,
                    0,
                    9
                  ],
                  "to": [
                    3.5,
                    3.14159274,
                    13.24115038
                  ],
                  "uvOrigin": [
                    0,
                    0
                  ],
                  "textureKey": "#skin",
                  "liftKind": "exact",
                  "provenance": "javap lift fluent addBox profile_proguard_obf"
                }
              ],
              "children": []
            }
          ]
        }
      ]
    }
  ],
  "jarPath": "hcy.class",
  "obfuscatedJvmName": "net.minecraft.client.model.effects.hcy",
  "classSha256Hex": "252215ba3d8dfeeafedbf14a5d505de526fb16c1c6fbff42a1723c6a347052cb",
  "bytecodeFloatProbe": [
    10,
    12,
    10,
    -5,
    24,
    -5,
    4,
    14,
    8,
    6.5,
    2.042035,
    3.5,
    9,
    3.1415927,
    4.2411504
  ],
  "liftSummary": {
    "cuboidApproxCount": 0,
    "poseApproxCount": 0,
    "delegationDepth": 0
  }
}