{
  "schemaVersion": 2,
  "versionLabel": "1.21.11",
  "officialJvmName": "net.minecraft.client.model.monster.vex.VexModel",
  "profile": "proguard_1.21.11",
  "extractionStatus": "partial",
  "extractionNotes": [
    "Part tree lifted from bytecode_asm (mesh host net.minecraft.client.model.monster.vex.VexModel).",
    "Strict structural validation failed (4): cuboid_lift_warning: forbidden cuboid liftWarning \u0027cube_deformation_obf_inferred\u0027; cuboid_lift_warning: forbidden cuboid liftWarning \u0027cube_deformation_obf_inferred\u0027; cuboid_lift_warning: forbidden cuboid liftWarning \u0027cube_deformation_obf_inferred\u0027; duplicate_part_id: duplicate part id \u0027root\u0027 in tree",
    "Mesh lift parser notes (1): Lifted via bytecode disassembly \u002B segment parser (exact pool constants)."
  ],
  "factoryMethod": "createBodyLayer",
  "roots": [
    {
      "id": "root",
      "pose": {
        "translation": [
          0,
          0,
          0
        ],
        "rotationEulerRad": [
          0,
          0,
          0
        ],
        "eulerOrder": "XYZ"
      },
      "cuboids": [],
      "children": [
        {
          "id": "root",
          "pose": {
            "translation": [
              0,
              -2.5,
              0
            ],
            "rotationEulerRad": [
              0,
              0,
              0
            ],
            "eulerOrder": "XYZ",
            "setupAnimPivot": [
              0,
              -2.5,
              0
            ]
          },
          "cuboids": [],
          "children": [
            {
              "id": "head",
              "pose": {
                "translation": [
                  0,
                  20,
                  0
                ],
                "rotationEulerRad": [
                  0,
                  0,
                  0
                ],
                "eulerOrder": "XYZ",
                "setupAnimPivot": [
                  0,
                  20,
                  0
                ]
              },
              "cuboids": [
                {
                  "from": [
                    -5,
                    -2.5,
                    5
                  ],
                  "to": [
                    0,
                    2.5,
                    5
                  ],
                  "uvOrigin": [
                    0,
                    0
                  ],
                  "textureKey": "#skin",
                  "liftKind": "exact",
                  "provenance": "javap lift fluent addBox profile_proguard_obf"
                }
              ],
              "children": []
            },
            {
              "id": "body",
              "pose": {
                "translation": [
                  0,
                  20,
                  0
                ],
                "rotationEulerRad": [
                  0,
                  0,
                  0
                ],
                "eulerOrder": "XYZ",
                "setupAnimPivot": [
                  0,
                  20,
                  0
                ]
              },
              "cuboids": [
                {
                  "from": [
                    0,
                    -1,
                    3
                  ],
                  "to": [
                    4,
                    1,
                    3
                  ],
                  "uvOrigin": [
                    0,
                    10
                  ],
                  "textureKey": "#skin",
                  "liftKind": "exact",
                  "provenance": "javap lift fluent addBox profile_proguard_obf"
                },
                {
                  "from": [
                    1,
                    -1,
                    3
                  ],
                  "to": [
                    6,
                    1,
                    2.799999997
                  ],
                  "uvOrigin": [
                    0,
                    16
                  ],
                  "textureKey": "#skin",
                  "liftKind": "exact",
                  "provenance": "javap lift fluent addBox profile_proguard_obf",
                  "liftWarnings": [
                    "cube_deformation_obf_inferred"
                  ],
                  "inflate": -0.200000003
                }
              ],
              "children": []
            },
            {
              "id": "right_arm",
              "pose": {
                "translation": [
                  -1.75,
                  0.25,
                  0
                ],
                "rotationEulerRad": [
                  0,
                  0,
                  0
                ],
                "eulerOrder": "XYZ",
                "setupAnimPivot": [
                  -1.75,
                  0.25,
                  0
                ]
              },
              "cuboids": [
                {
                  "from": [
                    -0.5,
                    -1,
                    2
                  ],
                  "to": [
                    3.5,
                    1,
                    1.899999999
                  ],
                  "uvOrigin": [
                    23,
                    0
                  ],
                  "textureKey": "#skin",
                  "liftKind": "exact",
                  "provenance": "javap lift fluent addBox profile_proguard_obf",
                  "liftWarnings": [
                    "cube_deformation_obf_inferred"
                  ],
                  "inflate": -0.100000001
                }
              ],
              "children": []
            },
            {
              "id": "left_arm",
              "pose": {
                "translation": [
                  1.75,
                  0.25,
                  0
                ],
                "rotationEulerRad": [
                  0,
                  0,
                  0
                ],
                "eulerOrder": "XYZ",
                "setupAnimPivot": [
                  1.75,
                  0.25,
                  0
                ]
              },
              "cuboids": [
                {
                  "from": [
                    -0.5,
                    -1,
                    2
                  ],
                  "to": [
                    3.5,
                    1,
                    1.899999999
                  ],
                  "uvOrigin": [
                    23,
                    6
                  ],
                  "textureKey": "#skin",
                  "liftKind": "exact",
                  "provenance": "javap lift fluent addBox profile_proguard_obf",
                  "liftWarnings": [
                    "cube_deformation_obf_inferred"
                  ],
                  "inflate": -0.100000001
                }
              ],
              "children": []
            },
            {
              "id": "left_wing",
              "pose": {
                "translation": [
                  0.5,
                  1,
                  1
                ],
                "rotationEulerRad": [
                  0,
                  0,
                  0
                ],
                "eulerOrder": "XYZ",
                "setupAnimPivot": [
                  0.5,
                  1,
                  1
                ]
              },
              "cuboids": [
                {
                  "from": [
                    0,
                    0,
                    0
                  ],
                  "to": [
                    5,
                    8,
                    0
                  ],
                  "uvOrigin": [
                    16,
                    14
                  ],
                  "textureKey": "#skin",
                  "liftKind": "exact",
                  "provenance": "javap lift fluent addBox profile_proguard_obf"
                }
              ],
              "children": []
            },
            {
              "id": "right_wing",
              "pose": {
                "translation": [
                  -0.5,
                  1,
                  1
                ],
                "rotationEulerRad": [
                  0,
                  0,
                  0
                ],
                "eulerOrder": "XYZ",
                "setupAnimPivot": [
                  -0.5,
                  1,
                  1
                ]
              },
              "cuboids": [
                {
                  "from": [
                    0,
                    0,
                    0
                  ],
                  "to": [
                    5,
                    8,
                    0
                  ],
                  "uvOrigin": [
                    16,
                    14
                  ],
                  "textureKey": "#skin",
                  "liftKind": "exact",
                  "provenance": "javap lift fluent addBox profile_proguard_obf"
                }
              ],
              "children": []
            }
          ]
        }
      ]
    }
  ],
  "jarPath": "hfp.class",
  "obfuscatedJvmName": "net.minecraft.client.model.monster.vex.hfp",
  "classSha256Hex": "20becee8ad09d7c09c05d8e18ef908b3d5b4ff47228011c63bdabcc951dbbbac",
  "bytecodeFloatProbe": [
    -2.5,
    -2.5,
    -5,
    -2.5,
    5,
    5,
    5,
    20,
    -1.5,
    -1,
    3,
    4,
    -1.5,
    -1,
    3,
    5,
    -0.2,
    20,
    -1.25,
    -0.5,
    -1,
    4,
    -0.1,
    -1.75,
    0.25,
    -0.75,
    -0.5,
    -1,
    4,
    -0.1,
    1.75,
    0.25,
    5,
    8,
    0.5,
    5,
    8,
    -0.5
  ],
  "liftSummary": {
    "cuboidApproxCount": 0,
    "poseApproxCount": 0,
    "delegationDepth": 0
  }
}