{
  "schemaVersion": 2,
  "versionLabel": "1.21.11",
  "officialJvmName": "net.minecraft.client.model.object.skull.SkullModel",
  "profile": "proguard_1.21.11",
  "extractionStatus": "ok",
  "extractionNotes": [
    "Part tree lifted from bytecode_asm (mesh host net.minecraft.client.model.object.skull.SkullModel).",
    "Mesh lift parser notes (1): Lifted via bytecode disassembly \u002B segment parser (exact pool constants)."
  ],
  "factoryMethod": "createBodyLayer",
  "roots": [
    {
      "id": "root",
      "pose": {
        "translation": [
          0,
          0,
          0
        ],
        "rotationEulerRad": [
          0,
          0,
          0
        ],
        "eulerOrder": "XYZ"
      },
      "cuboids": [],
      "children": [
        {
          "id": "head",
          "pose": {
            "translation": [
              0,
              0,
              0
            ],
            "rotationEulerRad": [
              0,
              0,
              0
            ],
            "eulerOrder": "XYZ",
            "setupAnimPivot": [
              0,
              0,
              0
            ]
          },
          "cuboids": [
            {
              "from": [
                -4,
                -8,
                -4
              ],
              "to": [
                4,
                0,
                4
              ],
              "uvOrigin": [
                0,
                0
              ],
              "textureKey": "#skin",
              "liftKind": "exact",
              "provenance": "javap lift fluent addBox profile_proguard_obf"
            }
          ],
          "children": [
            {
              "id": "hat",
              "pose": {
                "translation": [
                  0,
                  0,
                  0
                ],
                "rotationEulerRad": [
                  0,
                  0,
                  0
                ],
                "eulerOrder": "XYZ",
                "setupAnimPivot": [
                  0,
                  0,
                  0
                ]
              },
              "cuboids": [
                {
                  "from": [
                    -8,
                    -4,
                    8
                  ],
                  "to": [
                    0,
                    4,
                    8.25
                  ],
                  "uvOrigin": [
                    32,
                    0
                  ],
                  "textureKey": "#skin",
                  "liftKind": "exact",
                  "provenance": "javap lift fluent addBox profile_proguard_obf",
                  "inflate": 0.25
                }
              ],
              "children": []
            }
          ]
        }
      ]
    }
  ],
  "jarPath": "hhl.class",
  "obfuscatedJvmName": "net.minecraft.client.model.object.skull.hhl",
  "classSha256Hex": "a5204c5353eef014e579724d2dac452509b9d50e4a179de70a4e9a42676fe3f8",
  "bytecodeFloatProbe": [
    -4,
    -8,
    -4,
    8,
    8,
    8,
    -4,
    -8,
    -4,
    8,
    8,
    8,
    0.25
  ],
  "liftSummary": {
    "cuboidApproxCount": 0,
    "poseApproxCount": 0,
    "delegationDepth": 0
  }
}