{
  "schemaVersion": 2,
  "versionLabel": "1.21.11",
  "officialJvmName": "net.minecraft.client.model.animal.parrot.ParrotModel$Pose",
  "profile": "proguard_1.21.11",
  "extractionStatus": "skipped",
  "extractionNotes": [
    "No static mesh factory on net.minecraft.client.model.animal.parrot.ParrotModel$Pose; structural lift skipped (interface, inner class, or non-mesh type)."
  ],
  "factoryMethod": "createBodyLayer",
  "roots": [
    {
      "id": "root",
      "pose": {
        "translation": [
          0,
          0,
          0
        ],
        "rotationEulerRad": [
          0,
          0,
          0
        ],
        "eulerOrder": "XYZ"
      },
      "cuboids": [],
      "children": []
    }
  ],
  "jarPath": "hce$a.class",
  "obfuscatedJvmName": "net.minecraft.client.model.animal.parrot.hce$a",
  "classSha256Hex": "ac75bbd9a525d8f26436be47e19377e8cb826dfbc3508e97bb3dcbb59f1f1bbc",
  "bytecodeFloatProbe": [],
  "liftSummary": {
    "cuboidApproxCount": 0,
    "poseApproxCount": 0,
    "delegationDepth": 0
  }
}