{
  "schemaVersion": 2,
  "versionLabel": "1.21.11",
  "officialJvmName": "net.minecraft.client.model.ArmedModel",
  "profile": "proguard_1.21.11",
  "extractionStatus": "skipped",
  "extractionNotes": [
    "No static mesh factory on net.minecraft.client.model.ArmedModel; structural lift skipped (interface, inner class, or non-mesh type)."
  ],
  "factoryMethod": "createBodyLayer",
  "roots": [
    {
      "id": "root",
      "pose": {
        "translation": [
          0,
          0,
          0
        ],
        "rotationEulerRad": [
          0,
          0,
          0
        ],
        "eulerOrder": "XYZ"
      },
      "cuboids": [],
      "children": []
    }
  ],
  "jarPath": "gzk.class",
  "obfuscatedJvmName": "net.minecraft.client.model.gzk",
  "classSha256Hex": "10612f08c78a6cd938f3c8f7d2b0a28e531edc8b6a92df557e10859fa499282e",
  "bytecodeFloatProbe": [],
  "liftSummary": {
    "cuboidApproxCount": 0,
    "poseApproxCount": 0,
    "delegationDepth": 0
  }
}