{
  "schemaVersion": 2,
  "versionLabel": "1.21.11",
  "officialJvmName": "net.minecraft.client.model.animal.equine.HorseModel",
  "profile": "proguard_1.21.11",
  "extractionStatus": "skipped",
  "extractionNotes": [
    "No static mesh factory on net.minecraft.client.model.animal.equine.HorseModel; structural lift skipped (interface, inner class, or non-mesh type)."
  ],
  "factoryMethod": "createBodyLayer",
  "roots": [
    {
      "id": "root",
      "pose": {
        "translation": [
          0,
          0,
          0
        ],
        "rotationEulerRad": [
          0,
          0,
          0
        ],
        "eulerOrder": "XYZ"
      },
      "cuboids": [],
      "children": []
    }
  ],
  "jarPath": "has.class",
  "obfuscatedJvmName": "net.minecraft.client.model.animal.equine.has",
  "classSha256Hex": "ee8d3abde04a28dcea785145817f0045fea83f44becf312a2c49a9f4b154e140",
  "bytecodeFloatProbe": [],
  "liftSummary": {
    "cuboidApproxCount": 0,
    "poseApproxCount": 0,
    "delegationDepth": 0
  }
}